{
  "schema_version": 1,
  "id": "numthy.quadratic-field-arithmetic",
  "title": "Exact arithmetic in Q(sqrt(235))",
  "domains": [
    "numthy",
    "commalg"
  ],
  "source": {
    "intake_id": "arxiv-2404-06858-quadratic-field-arithmetic",
    "kind": "paper",
    "citation": "Claus Fieker and Tommy Hofmann, Number Theory in OSCAR, arXiv:2404.06858",
    "url": "https://arxiv.org/abs/2404.06858",
    "license": "arXiv nonexclusive distribution license",
    "redistribution": "citation-only",
    "retrieved_at": "2026-08-26",
    "sha256": "c4437fd384e1552e973264b6d3cac2fb80488da34bcf36c03af13ab2cfeb8877"
  },
  "translation": {
    "kind": "translation",
    "notes": "The quadratic field, integral basis, discriminant, primes above 7, and factorization of the principal ideal generated by sqrt(235) are translated to Noether. The program and prose are original and stop before the source's unsupported class- and unit-group computations."
  },
  "noether": {
    "version": "0.3.2",
    "operations": [
      "commalg.PolynomialRing.generator",
      "numthy.NumberField.degree",
      "numthy.NumberField.signature",
      "numthy.NumberField.discriminant",
      "numthy.NumberField.maximal_order",
      "numthy.NumberFieldElement.trace",
      "numthy.NumberFieldElement.norm",
      "numthy.NumberFieldOrder.basis",
      "numthy.NumberFieldOrder.discriminant",
      "numthy.NumberFieldOrder.is_maximal",
      "numthy.NumberFieldOrder.prime_ideals_above",
      "commalg.PrimeIdeal.verify",
      "commalg.PrimeIdeal.norm",
      "numthy.NumberFieldOrder.fractional_ideal",
      "numthy.FractionalIdeal.norm",
      "numthy.FractionalIdeal.factor"
    ]
  },
  "execution": {
    "entrypoint": "solution.py",
    "timeout_seconds": 30,
    "seed": null
  }
}
